{
  "$schema": "https://sci-d-vis.com/schema/wtrl-authoring-object-json-0.1.0.schema.json",
  "$id": "urn:waterlint:wtrl-authoring-object-json:valid-inherited-method",
  "__WTRL_CATEGORY__": "wtrl-authoring-object-json",
  "__WTRL_VERSION__": {
    "schema": "0.1.0"
  },
  "qualified_name": "demo.module.SpecialWidget.set_name",
  "profile": "inherited_method",
  "signature": "(self, name: str) -> None",
  "doc": {
    "Preamble": {
      "profile": "inherited_method",
      "normative_sections": [
        "Contract"
      ]
    },
    "Contract": {
      "general": [
        "|Must| retain the inherited name-update behavior."
      ],
      "base": "demo.module.Widget.set_name"
    }
  }
}
