{
  "$schema": "https://sci-d-vis.com/schema/wtrl-authoring-object-json-0.1.0.schema.json",
  "$id": "urn:waterlint:wtrl-authoring-object-json:valid-module",
  "__WTRL_CATEGORY__": "wtrl-authoring-object-json",
  "__WTRL_VERSION__": {
    "schema": "0.1.0"
  },
  "qualified_name": "demo.module",
  "profile": "module",
  "doc": {
    "Preamble": {
      "profile": "module",
      "normative_sections": [
        "Contract"
      ],
      "scope": [
        "public"
      ]
    },
    "Contract": {
      "general": [
        "|Must| provide the demonstration API."
      ]
    },
    "Description": [
      {
        "paragraph": "A complete logical paragraph."
      },
      {
        "list": [
          {
            "text": "A complete list item.",
            "items": [
              {
                "text": "A complete nested list item."
              }
            ]
          }
        ]
      }
    ]
  }
}
