{
  "$schema": "https://sci-d-vis.com/schema/wtrl-authoring-object-json-0.1.0.schema.json",
  "$id": "urn:waterlint:wtrl-authoring-object-json:valid-method",
  "__WTRL_CATEGORY__": "wtrl-authoring-object-json",
  "__WTRL_VERSION__": {
    "schema": "0.1.0"
  },
  "qualified_name": "demo.module.Widget.set_name",
  "profile": "method",
  "signature": "(self, name: str) -> None",
  "doc": {
    "Preamble": {
      "profile": "method",
      "normative_sections": [
        "Contract",
        "Parameters",
        "Returns",
        "Raises"
      ]
    },
    "Contract": {
      "general": [
        "|Must| update the widget name."
      ],
      "ensures": [
        "|Must| set the current name to |var|`name`."
      ]
    },
    "Parameters": {
      "name": [
        {
          "paragraph": "The new widget name."
        }
      ]
    },
    "Returns": [
      {
        "paragraph": "|None|."
      }
    ],
    "Raises": {}
  }
}
